question,answerA,answerB,answerC,answerD,correctAnswer,,,,,,,,,,,,,,,,,,,
একই সনে জন্মগ্রহণ করেছে যে দুই কবি ,মাইকেল মধুসূদন দত্ত ও ঈশ্বরচন্দ্র গুপ্ত ,রবীন্দ্রনাথ ঠাকুর ও দ্বিজেন্দ্রলাল রায় ,কাজী নজরুল ইসলাম ও জীবনানন্দ দাশ ,সত্যেন্দ্রনাথ দত্ত ও জসীমউদ্দীন ,3,",",',",",',',",",',"',",',',",",',সত্যেন্দ্রনাথ দত্ত ও জসীমউদ্দীন ,',",",',3,');,#REF!
কোন প্রবচনটি হতভাগ্য অর্থে ব্যবহৃত ? ,আট কপালে ,উড়নচণ্ডী ,ছা-পোষা ,কোনটিই নয় ,1,",",',",",',',",",',"',",',',",",',কোনটিই নয় ,',",",',1,');,#REF!
ভূষণ্ডির কাক অর্থ কি? ,ষড়যন্ত্রকারী ,দীর্ঘায়ু ব্যক্তি ,বাক সর্বস্ত ,দীর্ঘ প্রত্যক্ষমাণ ,2,",",',",",',',",",',"',",',',",",',দীর্ঘ প্রত্যক্ষমাণ ,',",",',2,');,#REF!
কোন কবি নিজেকে বাঙালি বলে পরিচয় দিয়েছেন? ,গোবিন্দ দাস ,কাহ্নপা ,কায়কোবাদ ,ভুসুকুপা ,4,",",',",",',',",",',"',",',',",",',ভুসুকুপা ,',",",',4,');,#REF!
কোন প্রকার শব্দের মূল নির্ধারণ করা যায় না? ,তদ্ভব ,অর্থ-তৎসম ,দেশি ,তৎসম ,3,",",',",",',',",",',"',",',',",",',তৎসম ,',",",',3,');,#REF!
কোনটি অর্থ-তৎসম শব্দ? ,জ্যোছনা ,সূর্য ,সুনাম ,জবান ,1,",",',",",',',",",',"',",',',",",',জবান ,',",",',1,');,#REF!
ধাতুরূপ ব্যাকরণের কোন অংশে আলোচিত হয়? ,ধ্বনিতত্ত্বে ,রূপতত্ত্ব ,বাক্যতত্ত্বে ,ছন্দতত্ত্ব ,2,",",',",",',',",",',"',",',',",",',ছন্দতত্ত্ব ,',",",',2,');,#REF!
আহবান এর প্রকৃত উচ্চারণ কোনটি? ,আহ্বান ,আহবান ,আবহান ,আওভান ,4,",",',",",',',",",',"',",',',",",',আওভান ,',",",',4,');,#REF!
"কবাট> কপাট, ধোবা> ধোপা কিসের উদাহরণ? ",ধ্বনি বিপর্যয় ,অভিশ্রুতি ,ব্যঞ্জন বিকৃতি ,ব্যঞ্জন চ্যুতি ,3,",",',",",',',",",',"',",',',",",',ব্যঞ্জন চ্যুতি ,',",",',3,');,#REF!
কোনটি স্বরভক্তির উদাহরণ? ,পিরীতি ,বিলিতি ,বসতি ,জানালা ,1,",",',",",',',",",',"',",',',",",',জানালা ,',",",',1,');,#REF!
আফতাব শব্দের সমার্থক কোনটি ? ,অর্নব ,অর্ক ,রাতুল ,জলধি ,2,",",',",",',',",",',"',",',',",",',জলধি ,',",",',2,');,#REF!
বৃষ্টি এর সন্ধি বিচ্ছেদ কি হবে? ,বৃষ + টি ,বৃশ + টি ,বৃ + টি ,বৃষ্‌ + তি ,4,",",',",",',',",",',"',",',',",",',বৃষ্‌ + তি ,',",",',4,');,#REF!
নয়ন এর সঠিক প্রকৃতি প্রত্যয় কী? ,নী + অট ,নে + অনট ,নী + অনট্‌ ,নে + অট ,3,",",',",",',',",",',"',",',',",",',নে + অট ,',",",',3,');,#REF!
কোনটি নিত্য সমাসের সমস্ত পদ? ,গ্রামান্তর ,নরপশু ,মনমাঝি ,উপনদী ,1,",",',",",',',",",',"',",',',",",',উপনদী ,',",",',1,');,#REF!
সংশয় এর বিপরীতার্থক শব্দ কোনটি? ,দ্বিধা ,প্রত্যয় ,নির্ভয় ,বিস্ময় ,2,",",',",",',',",",',"',",',',",",',বিস্ময় ,',",",',2,');,#REF!
অভিনিবেশ শব্দটির অর্থ কী? ,অভিরুচি ,নিস্পৃহ ,বিশেষভাবে ,মনোযোগ ,4,",",',",",',',",",',"',",',',",",',মনোযোগ ,',",",',4,');,#REF!
নিচের কোন স্ত্রীবাচক শব্দের দুটি পুরুষবাচক শব্দ রয়েছে? ,কুলটা ,ইবীন ,ননদ ,কবিরাজ ,3,",",',",",',',",",',"',",',',",",',কবিরাজ ,',",",',3,');,#REF!
নিচের কোন শব্দে ণ এর ভুল প্রয়োগ রয়েছে ,ক্রন্দণ ,চাণক্য ,মাণিক্য ,গণ ,1,",",',",",',',",",',"',",',',",",',গণ ,',",",',1,');,#REF!
ধ্বনিবাচক দ্বিরুক্ত শব্দ কোনটি? ,মরমর ,কড়কড় ,নরনর ,দরদর ,2,",",',",",',',",",',"',",',',",",',দরদর ,',",",',2,');,#REF!
ডাক্তার সাহেবের হাত যশ ভাল এ বাক্য হাত ব্যবহৃত হয়েছে ,বশ অর্থে ,অধিকার অর্থে ,অভ্যাস অর্থে ,নিপুণতা অর্থে ,4,",",',",",',',",",',"',",',',",",',নিপুণতা অর্থে ,',",",',4,');,#REF!
কোন বানানটি অশুদ্ধ? ,সুকেশী ,সুকেশা ,সুকেশীনী ,সুকেশিনী ,3,",",',",",',',",",',"',",',',",",',সুকেশিনী ,',",",',3,');,#REF!
কোনটি বাংলা ব্যাকরণের শাখা নয়? ,ভাষাতত্ত্ব ,রূপতত্ত্ব ,ধ্বনিতত্ত্ব ,বাক্যতত্ত্ব ,1,",",',",",',',",",',"',",',',",",',বাক্যতত্ত্ব ,',",",',1,');,#REF!
ক্ষীয়মান এর বিপরীত শব্দ কি? ,বৃহৎ ,বর্ধমান ,রেনেসাঁ ,বৃদ্ধিপ্রাপ্ত ,2,",",',",",',',",",',"',",',',",",',বৃদ্ধিপ্রাপ্ত ,',",",',2,');,#REF!
ঐহিক এর বিপরীতার্থক শব্দ কি? ,পাঞ্জেরী ,সম্মিলিত ,রেনেসাঁ ,পারত্রিক ,4,",",',",",',',",",',"',",',',",",',পারত্রিক ,',",",',4,');,#REF!
কোনটি শুদ্ধ বানান? ,তৃহায়ন ,ত্রিহায়ন ,ত্রিহায়ণ ,তৃহায়ণ ,3,",",',",",',',",",',"',",',',",",',তৃহায়ণ ,',",",',3,');,#REF!
লিঙ্গান্তর হয় না এমন শব্দ কোনটি? ,কবিরাজ ,সাহেব ,সঙ্গী ,বেয়াই ,1,",",',",",',',",",',"',",',',",",',বেয়াই ,',",",',1,');,#REF!
ঝাঁকের কি বাগধারাটির অর্থ ,অসম্ভব চালাক ,একই দলের লোক ,বর্ষাকালীন মাছ ,একতাই বল ,2,",",',",",',',",",',"',",',',",",',একতাই বল ,',",",',2,');,#REF!
রাজা রামমোহন রচিত বাংলা ব্যাকরণের নাম কি? ,মাগধীয় ব্যাকরণ ,মাতৃভাষা ব্যাকরণ ,ভাষা ও ব্যাকরণ ,গৌড়ীয় ব্যাকরণ ,4,",",',",",',',",",',"',",',',",",',গৌড়ীয় ব্যাকরণ ,',",",',4,');,#REF!
মৌলিক শব্দ কোনটি? ,শীতল ,নেয়ে ,গোলাপ ,গৌরব ,3,",",',",",',',",",',"',",',',",",',গৌরব ,',",",',3,');,#REF!
কোন শব্দটি ফারসি? ,পেরেশান ,মুসাফির ,তকদির ,মজলুম ,1,",",',",",',',",",',"',",',',",",',মজলুম ,',",",',1,');,#REF!
জ্যোষ্ঠের বর্ত্মানে কনিষ্ঠের বিকে কে একশব্দে বলে ,পরিবন্ধন ,পরিবেদন ,পরিচারণ ,পরিণয়ন ,2,",",',",",',',",",',"',",',',",",',পরিণয়ন ,',",",',2,');,#REF!
যে সমাসের পূর্বপদ সংখ্যাবাচক এবং সমস্ত পদের দ্বারা সমাহার বোঝায় তাকে বলে? ,দ্বন্দ্ব সমাস ,বহুব্রীহি সমাস ,রূপক সমাস ,দ্বিগু সমাস ,4,",",',",",',',",",',"',",',',",",',দ্বিগু সমাস ,',",",',4,');,#REF!
বাংলা সাহিত্যের অনবদ্য উপন্যাস কপালকুণ্ডলা এর রচয়িতা কে? ,শরৎচন্দ্র চট্টোপাধ্যায় ,রবীন্দ্রনাথ ঠাকুর ,মধুসূদন দত্ত ,বঙ্কিমচন্দ্র চট্টোপাধ্যায় ,3,",",',",",',',",",',"',",',',",",',বঙ্কিমচন্দ্র চট্টোপাধ্যায় ,',",",',3,');,#REF!
যাহা কষ্টে নিবারণ করা যায় ,দুর্নিবার ,দুর্ল্ভ ,দুর্জয় ,অনির্বারণ ,1,",",',",",',',",",',"',",',',",",',অনির্বারণ ,',",",',1,');,#REF!
সাধুভাষা থেকে চলিত বাংলায় লিখতে কোন পদযুগলের পরিবর্তন ঘটে? ,বিশেষ্য ও বিশেষণ ,সর্বনাম ও ক্রিয়া ,বিশেষণ ও ক্রিয়া ,বিশেষ্য ও সর্বনাম ,2,",",',",",',',",",',"',",',',",",',বিশেষ্য ও সর্বনাম ,',",",',2,');,#REF!
শব্দার্থ অনুসারে বাংলা ভাষার শব্দ সমষ্টিকে ভাগ করা যায় ,পাঁচ ভাগে ,চার ভাগে ,তিন ভাগে ,দুই ভাগে ,3,",",',",",',',",",',"',",',',",",',দুই ভাগে ,',",",',3,');,#REF!
পর্তুগিজ ভাষা থেকে নিম্নোক্ত কোন শব্দটি বাংলা ভাষায় আত্তীকরণ করা হয়েছে? ,টেবিল ,চেয়ার ,শরবত ,বালতি ,4,",",',",",',',",",',"',",',',",",',বালতি ,',",",',4,');,#REF!
অপলাপ শব্দের অর্থ কি? ,অস্বীকার ,মিথ্যা ,প্রলাপ ,অসদালাপ ,1,",",',",",',',",",',"',",',',",",',অসদালাপ ,',",",',1,');,#REF!
নিম্নের কোনটি তৎসম শব্দ? ,মুড়ি ,দধি ,আম ,কলম ,2,",",',",",',',",",',"',",',',",",',কলম ,',",",',2,');,#REF!
জঙ্গম এর বিপরীতার্থক শব্দ কোনটি? ,অরন্য ,সমুদ্র ,স্থাবর ,পর্বত ,3,",",',",",',',",",',"',",',',",",',পর্বত ,',",",',3,');,#REF!
ঔদ্ধত্য এর বিপরীতার্থক শব্দ ? ,স্তদ্ধ ,হীনবল ,মাথা নত করা ,বিনয় ,4,",",',",",',',",",',"',",',',",",',বিনয় ,',",",',4,');,#REF!
আধুনিক বাংলা গীতি কবিতার উৎস কী? ,টপ্পা গান ,জারিগান ,গজল ,গম্ভীর গান ,1,",",',",",',',",",',"',",',',",",',গম্ভীর গান ,',",",',1,');,#REF!
নির্মোক কোন শব্দগুচ্ছের সংকুচিত রূপ? ,নিমক রাখার পাত্র ,সাপের খোলস ,ময়ূরের পেখম ,নির্মোহ ব্যক্তি ,2,",",',",",',',",",',"',",',',",",',নির্মোহ ব্যক্তি ,',",",',2,');,#REF!
শাক-সবজি শব্দটি নিচের কোন দুইয়ের মিলন? ,ফারসি + আরবি ,পর্তুগিজ + আরবি ,তৎসম + ফারসি ,তদ্ভব + ফারসি ,3,",",',",",',',",",',"',",',',",",',তদ্ভব + ফারসি ,',",",',3,');,#REF!
কোথায় থাকা হয় এটি কোন বাচ্যের উদাহরণ? ,ভাববাচ্য ,কর্মবাচ্য ,কর্তৃবাচ্য ,কোনটিই নয় ,1,",",',",",',',",",',"',",',',",",',কোনটিই নয় ,',",",',1,');,#REF!
রোমান্টিক কাব্যের কবি নয় কে? ,কোরেশী মাগন ঠাকুর ,দোনা গাজী চৌধুরী ,শাহ্‌ বারিদ খান ,শেখ ফয়জুলাহ ,4,",",',",",',',",",',"',",',',",",',শেখ ফয়জুলাহ ,',",",',4,');,#REF!
Prothesis এর বাংলা প্রতিশব্দ কোনটি? ,ধ্বনিস্নগযুক্তি ,আদিস্বরাগম ,স্বরভক্তি ,বিপ্রকর্ষ ,2,",",',",",',',",",',"',",',',",",',বিপ্রকর্ষ ,',",",',2,');,#REF!
বর্ষীয়ান এর প্রত্যয় ,বৃদ্ধ + ইয়স ,বৃদ্ধ + ত্রীয়স ,বৃদ্ধ + ঈয়স ,বৃদ্ধ + নীরস ,3,",",',",",',',",",',"',",',',",",',বৃদ্ধ + নীরস ,',",",',3,');,#REF!
বীণাপাণি কোন সমাসের উদাহরণ? ,ব্যাধিকরণ বহুব্রীহি ,সমানাধিকরণ বহুব্রীহি ,মধ্যপদলোপী বহুব্রীহি ,অলুক বহুব্রীহি ,1,",",',",",',',",",',"',",',',",",',অলুক বহুব্রীহি ,',",",',1,');,#REF!
বল বীর বল উন্নত মম শির বাক্যটি কি? ,ইচ্ছাসূচক ,প্রশ্নসূচক ,বিস্ময়সূচক ,আদেশসূচক ,4,",",',",",',',",",',"',",',',",",',আদেশসূচক ,',",",',4,');,#REF!
ব্রীহি শব্দের অর্থে ,বৃহৎ ,ধান ,সুশ্রী ,হাতির ডাক ,2,",",',",",',',",",',"',",',',",",',হাতির ডাক ,',",",',2,');,#REF!
বাবা কোন ভাষা থেকে আগত শব্দ? ,সংস্কৃত ,তুর্কি ,আরবী ,তুর্কি ,3,",",',",",',',",",',"',",',',",",',তুর্কি ,',",",',3,');,#REF!
কলাভৃৎ শব্দের সমার্থক শব্দ কী? ,চন্দ্র ,অগ্নি ,জল ,সূর্য ,1,",",',",",',',",",',"',",',',",",',সূর্য ,',",",',1,');,#REF!
জীবনানন্দ দাশের প্রমথ কাব্য কোনটি? ,ধুসর পাণ্ডুলিপি ,মহা পৃথিবী ,বনলতা সেন ,ঝরাপালক ,4,",",',",",',',",",',"',",',',",",',ঝরাপালক ,',",",',4,');,#REF!
কোনটি নিলীন বর্ণ ,ই ,অ ,উ ,এ ,2,",",',",",',',",",',"',",',',",",',এ ,',",",',2,');,#REF!
ক্ষ্ম যুক্ত বর্ণটি কীভাবে গঠিত হয়েছে? ,ক + ষ ,ষ্‌ + ম ,হ্‌ + ম ,ম্‌ + হ ,3,",",',",",',',",",',"',",',',",",',ম্‌ + হ ,',",",',3,');,#REF!
সিংহাসন শব্দটি কোন সমাস? ,মধ্যপদলোপী কর্মধারায় ,ষষ্ঠী তৎপুরুষ ,নিত্য সমাস ,নিমিত্তার্থে চতুর্থী ,1,",",',",",',',",",',"',",',',",",',নিমিত্তার্থে চতুর্থী ,',",",',1,');,#REF!
সম্পৃক্ত শব্দটির সঠিক অর্থ কোনটি? ,আটঁবাঁধা ,দুই বা অধিকের মিলন ,অন্তর্ভূক্ত ,সংযুক্ত ,4,",",',",",',',",",',"',",',',",",',সংযুক্ত ,',",",',4,');,#REF!
কোনটি তৎসম শব্দ? ,ঝিনুক ,সলিতা ,চন্দ্র ,পত্র ,3,",",',",",',',",",',"',",',',",",',পত্র ,',",",',3,');,#REF!
নিচের কোনটি যুগ্মরীতি দ্বিরুক্ত শব্দ? ,আয়-ব্যয় ,বই-টই ,ঝম-ঝম ,ঠা-ঠা ,2,",",',",",',',",",',"',",',',",",',ঠা-ঠা ,',",",',2,');,#REF!
সন্দেশ কোন শ্রেণির শব্দ? ,রূঢ়ি ,যোগরূঢ় ,যৌগিক ,তৎসম ,1,",",',",",',',",",',"',",',',",",',তৎসম ,',",",',1,');,#REF!
সমাস নিষ্পন্ন পদটিকে কি বলে? ,সমস্যমান পদ ,ব্যাসবাক্য ,উত্তরপদ ,সমস্ত পদ ,4,",",',",",',',",",',"',",',',",",',সমস্ত পদ ,',",",',4,');,#REF!
বাংলার মিল্টন বলা হয় কোন লেখককে? ,রবীন্দ্রনাথ ঠাকুর ,মালাধর বসু ,হেম চন্দ্র ,সতেন্দ্রনাথ দত্ত ,3,",",',",",',',",",',"',",',',",",',সতেন্দ্রনাথ দত্ত ,',",",',3,');,#REF!
কৃষ্ণকুমারী কী? ,একটি উপন্যাস ,একটি ট্রাজেডি নাটক ,একটি ছোট গল্প ,একটি কাব্য ,2,",",',",",',',",",',"',",',',",",',একটি কাব্য ,',",",',2,');,#REF!
বহুব্রীহি সমাসবদ্ধ পদ কোনটি? ,সবান্ধব ,মনমরা ,খাসমহল ,তপোবন ,1,",",',",",',',",",',"',",',',",",',তপোবন ,',",",',1,');,#REF!
যার জিহ্বা লকলক করে এক কথায় কী বলে? ,লিপ্সা ,লেহ্য ,যুযুৎসু ,লেলিহান ,4,",",',",",',',",",',"',",',',",",',লেলিহান ,',",",',4,');,#REF!
বিয়ে কোন ধরনের শব্দ? ,তৎসম ,অর্ধতৎসম ,তদ্ভব ,দেশি ,3,",",',",",',',",",',"',",',',",",',দেশি ,',",",',3,');,#REF!
নিচের কোনটি কবি নজরুল ইসলাম স্মপদিত পত্রিকা ? ,সমকাল ,ধূমকেতু ,মোসলেম ভারত ,সবুজ পত্র ,1,",",',",",',',",",',"',",',',",",',সবুজ পত্র ,',",",',1,');,#REF!
বাংলায় বংশানুক্রমিক শাসনের সূচনা হয় ,সেন বংশের মাধ্যমে ,পাল বংশের মাধ্যমে ,মৌর্য বংশের মাধ্যমে,চৌধুরী বংশের মাধ্যমে,2,",",',",",',',",",',"',",',',",",',চৌধুরী বংশের মাধ্যমে,',",",',2,');,#REF!
উদ্ধরণ চিহ্নের পূর্বে বসাতে হবে ,কোলন ,কোলন ড্যাস ,হাইফেন ,কমা ,4,",",',",",',',",",',"',",',',",",',কমা ,',",",',4,');,#REF!
রাত্রিকালীন যুদ্ধকে এক কথায় কী বলা হয়? ,ভুজঙ্গ ,নৈশরণ ,সৌপ্তিক ,জুগুপ্সা ,3,",",',",",',',",",',"',",',',",",',জুগুপ্সা ,',",",',3,');,#REF!
কোনটি বাগধারা বোঝায়? ,শিরে সংক্রান্তি ,চৈত্র সংক্রান্তি ,পৌষ সংক্রান্তি ,শিব-সংক্রান্তি ,1,",",',",",',',",",',"',",',',",",',শিব-সংক্রান্তি ,',",",',1,');,#REF!
আসাদের শার্ট কবিতার লেখক কে? ,আল মাহমুদ ,শামসুর রাহমান ,আবদুল মান্নান সৈয়দ ,অমিয় চক্রবর্তী ,2,",",',",",',',",",',"',",',',",",',অমিয় চক্রবর্তী ,',",",',2,');,#REF!
সুশীল কোন সমাস? ,তৎপুরুষ ,অলুক ,প্রানি ,বহুব্রীহি ,4,",",',",",',',",",',"',",',',",",',বহুব্রীহি ,',",",',4,');,#REF!
নিচের কোনটি জাতিবাচক বিশেষ্য? ,সমিতি ,সভা ,পর্বত ,মাহফিল ,3,",",',",",',',",",',"',",',',",",',মাহফিল ,',",",',3,');,#REF!
মধ্যযুগের বাংলা সাহিত্যে কোন ধর্ম প্রচারক এর প্রভাব অপরিসীম ? ,শ্রীচৈতন্যদেব ,আদিনাথ ,শ্রীকৃষ্ণ ,মনোহরদাশ ,1,",",',",",',',",",',"',",',',",",',মনোহরদাশ ,',",",',1,');,#REF!
বাংলা লিপির উদ্ভব হয়েছে কোন প্রাচীন লিপি থেকে? ,মাগধী লিপি ,ব্রাক্ষ্মীলিপি ,শ্যামা লিপি ,সিংহলী লিপি ,2,",",',",",',',",",',"',",',',",",',সিংহলী লিপি ,',",",',2,');,#REF!
আমার সন্তান যেন থাকে দুধে-ভাতে চরণটি কোন কাব্যের? ,মনসামঙ্গল ,ধর্মমঙ্গল ,চন্ডীমঙ্গল ,অন্নদা মঙ্গল ,4,",",',",",',',",",',"',",',',",",',অন্নদা মঙ্গল ,',",",',4,');,#REF!
বাংলা কবিতার আধুনিকতার প্রবর্তক কে? ,বিহারীলাল চক্রবর্তী ,সৌরভ কাজী ,মাইকেল মধুসূদন দত্ত ,চণ্ডীদাস ,3,",",',",",',',",",',"',",',',",",',চণ্ডীদাস ,',",",',3,');,#REF!
পুঁটিমাছের প্রাণ বাগধারাটির অর্থ কি? ,ক্ষীণজীবী ,অসম্ভব কিপটে ,সামান্য ত্রুটি ,দীর্ঘজীবী ,1,",",',",",',',",",',"',",',',",",',দীর্ঘজীবী ,',",",',1,');,#REF!
বিচ্ছেদ শব্দের সন্ধিবিচ্ছেদ কোনটি? ,বিচ + ছেদ ,বি + ছেদ ,বিচঃ + ছেদ ,বিঃ + ছেদ ,2,",",',",",',',",",',"',",',',",",',বিঃ + ছেদ ,',",",',2,');,#REF!
দরদি শব্দের বিপরীত শব্দ কোনটি? ,নিরীহ ,অদরদি ,উদ্ধত ,কোনটিই নয় ,4,",",',",",',',",",',"',",',',",",',কোনটিই নয় ,',",",',4,');,#REF!
নিচের কোনটি পূরণবাচক শব্দের উদাহরণ? ,পাঁচ ,পহেলা ,একাদশ ,সিকি ,3,",",',",",',',",",',"',",',',",",',সিকি ,',",",',3,');,#REF!
নিচের কোন শব্দটিতে ইংরেজি উপসর্গ ব্যবহৃত হয়েছে? ,ফুলবাবু ,অপমৃত্যু ,বাজেখরচ ,রামদা ,1,",",',",",',',",",',"',",',',",",',রামদা ,',",",',1,');,#REF!
অনেকের মধ্য এক এর সঠিক বাক্য সংকোচন হলো ,অনন্য ,অন্যতম ,অসাধারণ ,শ্রেষ্ঠ ,2,",",',",",',',",",',"',",',',",",',শ্রেষ্ঠ ,',",",',2,');,#REF!
ডাকাবুকো প্রবাদটির অর্থ কি? ,বদরাগী ,চাটুকার ,দূরত্ব ,কোনটিই নয় ,4,",",',",",',',",",',"',",',',",",',কোনটিই নয় ,',",",',4,');,#REF!
ম্যাও ধরা শব্দে ধরা শব্দটি কোন বিশেষ অর্থে ব্যবহৃত হয়েছে ,পছন্দ হওয়া ,একগুঁয়েমি দেখানো ,দায়িত্ব নেওয়া ,অনুরোধ করা ,3,",",',",",',',",",',"',",',',",",',অনুরোধ করা ,',",",',3,');,#REF!
অম্বর শব্দটির সঠিক প্রতিশব্দ কোনটি ? ,আকাশ ,বায়ু ,বন ,সাগর ,1,",",',",",',',",",',"',",',',",",',সাগর ,',",",',1,');,#REF!
মুক্তিযুদ্ধ বিষয়ক গ্রন্থ একাত্তরের দিনগুলি কে রচনা করেছেন? ,সুফিয়া কামাল ,জাহানারা ইমাম ,শামসুর রাহমান ,সেলিনা হোসেন ,2,",",',",",',',",",',"',",',',",",',সেলিনা হোসেন ,',",",',2,');,#REF!
কোনটি অপাদান কারক? ,গৃহহীনে গৃহ দাও ,জিজ্ঞাসিব জনে জনে ,বনে বাঘ আছে ,ট্রেন স্টেশন ছেড়েছে ,4,",",',",",',',",",',"',",',',",",',ট্রেন স্টেশন ছেড়েছে ,',",",',4,');,#REF!
