question,answerA,answerB,answerC,answerD,correctAnswer,,,,,,,,,,,,,,,,,,,
জীবনান্দ দাশের কাব্যে ব্যবহৃত শঙ্খমালা হলো ,কবির জীবনদেবতা ,পূর্বপরিচিতা নারী ,রোমান্টিক কবিকল্পনা ,রূপকথার চরিত্র ,2,",",',",",',',",",',"',",',',",",',রূপকথার চরিত্র ,',",",',2,');,#REF!
চেষ্টায় সুসিদ্ধ করে জীবনের আশা বাক্যটি কার রচনা? ,শাহাদাৎ হোসেন ,মাইকেল মধুসূদন দত্ত ,ভারতচন্দ্র ,ঈশ্বরচন্দ্র গুপ্ত ,4,",",',",",',',",",',"',",',',",",',ঈশ্বরচন্দ্র গুপ্ত ,',",",',4,');,#REF!
নিচের কোন বানানটি শুদ্ধ? ,মূহুর্মুহু ,মুহুমূর্হু ,মুহুর্মুহু ,মুর্হুমুহু ,3,",",',",",',',",",',"',",',',",",',মুর্হুমুহু ,',",",',3,');,#REF!
নিচের কোন বানানটি অশুদ্ধ? ,নিষ্পন্দ ,নিষ্পন্ন ,নিস্ফল ,নিস্পৃহ ,1,",",',",",',',",",',"',",',',",",',নিস্পৃহ ,',",",',1,');,#REF!
কোন বানানটি অশুদ্ধ? ,নারীত্ব ,সতিত্ব ,কৃতিত্ব ,ব্যক্তিত্ব ,2,",",',",",',',",",',"',",',',",",',ব্যক্তিত্ব ,',",",',2,');,#REF!
সমুদ্র শব্দটির সমার্থক ,সলিল ,সৈকত ,তটিনী ,জলধি ,4,",",',",",',',",",',"',",',',",",',জলধি ,',",",',4,');,#REF!
Attested এর বাংলা পরিভাষা ,সংযুক্ত ,স্বাক্ষরযুক্ত ,সত্যায়িত ,নিবন্ধিত ,3,",",',",",',',",",',"',",',',",",',নিবন্ধিত ,',",",',3,');,#REF!
নিচের কোনটি অর্থগত দিকথেকে সাদৃশ্যপূর্ণ নয়? ,অলক ,লোচন ,চিকুর ,কবরী ,2,",",',",",',',",",',"',",',',",",',কবরী ,',",",',2,');,#REF!
কেবল জন্তুর বহুবচনে ব্যবহৃত হয় এমন শব্দ হলো- ,আবলি ,গণ ,সকল ,পাল,4,",",',",",',',",",',"',",',',",",',পাল,',",",',4,');,#REF!
কোন শব্দটি সঠিক? ,পারদর্শী ,প্রতিযোগীতা ,ভৌগলিক ,গুনীজন ,1,",",',",",',',",",',"',",',',",",',গুনীজন ,',",",',1,');,#REF!
"সে না এলে তুমি যাবে না, কিন্তু সে বলে পাঠিয়েছে যে তার আসতে দেরি হবে। এটি কোন ধরনের বাক্য? ",মিশ্র ,জটিল ,যৌগিক ,সরল ,3,",",',",",',',",",',"',",',',",",',সরল ,',",",',3,');,#REF!
ঐহিক শব্দের বিপরীত শব্দ হলো- ,বিষণ্ম ,বিবাদ ,বৈরাগ্য ,পারত্রিক ,4,",",',",",',',",",',"',",',',",",',পারত্রিক ,',",",',4,');,#REF!
যে স্বামীর স্ত্রী বিদেশ থাকে তাকে কী বলে? ,বিদেশিনী ,প্রোষিতভর্তৃকা ,প্রোষিপত্নীক ,প্রবাসিনী ,3,",",',",",',',",",',"',",',',",",',প্রবাসিনী ,',",",',3,');,#REF!
কোন উপসর্গটি ভিন্নার্থে প্রযুক্ত? ,উপগ্রহ ,উপকূল ,উপজাতি ,উপসাগর ,2,",",',",",',',",",',"',",',',",",',উপসাগর ,',",",',2,');,#REF!
নিচের কোন শব্দে নারী ও পুরুষ দুই-ই বুঝায়? ,সন্তান ,সধবা ,সতীন ,কবিরাজ ,1,",",',",",',',",",',"',",',',",",',কবিরাজ ,',",",',1,');,#REF!
উজান শব্দের বিপরীত শব্দ কী? ,ভাটা ,জোয়ার ,ভাটি ,কূজন ,3,",",',",",',',",",',"',",',',",",',কূজন ,',",",',3,');,#REF!
কর দান করে যে এক কথায়- ,অধীন ,আশ্রিত ,প্রজা ,করদ ,4,",",',",",',',",",',"',",',',",",',করদ ,',",",',4,');,#REF!
কোনটি বিশেষণ? ,দিন ,দীন ,দিনান্ত ,দিন-রাত ,2,",",',",",',',",",',"',",',',",",',দিন-রাত ,',",",',2,');,#REF!
কোনটি বহুবীহি সমাসের উদাহরণ? ,মহাত্মা ,চা-বিস্কুট ,তেমাথা ,মনগড়া ,1,",",',",",',',",",',"',",',',",",',মনগড়া ,',",",',1,');,#REF!
রবীন্দ্রনাথ ঠাকুর শেষের কবিতা একটি ,কবিতা ,কাব্যগ্রন্থ ,ছোটগল্প ,উপন্যাস ,4,",",',",",',',",",',"',",',',",",',উপন্যাস ,',",",',4,');,#REF!
নিচের কোন বানানটি শুদ্ধ? ,একন্নবতী ,একান্নবত্তী ,একান্নবর্তী ,একান্নবর্ত্তী ,3,",",',",",',',",",',"',",',',",",',একান্নবর্ত্তী ,',",",',3,');,#REF!
কোন শব্দটিতে তৎসম উপসর্গ ব্যবহৃত হয়েছে? ,প্রভাত ,উনপাজুরে ,কদর্য ,বরখাস্ত ,1,",",',",",',',",",',"',",',',",",',বরখাস্ত ,',",",',1,');,#REF!
ভাবাধিকরণ কারকের উদাহরণ কোনটি? ,সে স্কুলে যায় নি ,সূর্যোদয়ে পদ্ম ফোটে ,বিকালে খেলতে যাওয়া ,চেষ্টায় সব হয় ,2,",",',",",',',",",',"',",',',",",',চেষ্টায় সব হয় ,',",",',2,');,#REF!
উগ্র শব্দের বিপরীতার্থক শব্দ ,চপল ,গম্ভীর ,বিজ্ঞ ,সৌম্য ,4,",",',",",',',",",',"',",',',",",',সৌম্য ,',",",',4,');,#REF!
নিম্নের কোনটি মিলনার্থক শব্দযোগে গঠিত শব্দ? ,হাট-বাজার ,চা-বিস্কুট ,দা-কুমড়া ,ছোট-বড় ,2,",",',",",',',",",',"',",',',",",',ছোট-বড় ,',",",',2,');,#REF!
কোনটি ভাব অর্থে ব্যবহৃত শব্দ? ,পাগলামি ,ঠকানো ,জমিদার ,ভাগলপুরি ,1,",",',",",',',",",',"',",',',",",',ভাগলপুরি ,',",",',1,');,#REF!
কোনটি মৌলিক শব্দ? ,নীলাকাশ ,দৌহিত্র ,গোলাপ ,গরুখোঁজ ,3,",",',",",',',",",',"',",',',",",',গরুখোঁজ ,',",",',3,');,#REF!
কোনটি প্রযোজক ক্রিয়া দ্বারা গঠিত? ,মাথা ঝিমঝিম করছে ,মা শিশুটিকে হাসান ,তোমার পরিশ্রমের ফল ফলেছে ,শিশুটি কাঁদে ,2,",",',",",',',",",',"',",',',",",',শিশুটি কাঁদে ,',",",',2,');,#REF!
কার্যে বিরতি অর্থে কোন বাগধারাটি প্রযোজ্য? ,হাত করা ,হাত থাকা ,হাত আসা ,হাত গুটান ,4,",",',",",',',",",',"',",',',",",',হাত গুটান ,',",",',4,');,#REF!
কোনটি কর্মকর্তৃবাচ্য? ,একবার একটি গান করা হোক ,বাঁশি বাজে এ মধুর লগনে ,তার যেন আসা হয়। ,তুমি হাঁটবে ,2,",",',",",',',",",',"',",',',",",',তুমি হাঁটবে ,',",",',2,');,#REF!
রেলগাড়ি কোন সমাসের উদাহরণ? ,মধ্যপদলোপী কর্মধারয় ,দ্বিগু সমাস ,তৎপুরুষ সমাস ,দ্বন্দ্ব সমাস ,1,",",',",",',',",",',"',",',',",",',দ্বন্দ্ব সমাস ,',",",',1,');,#REF!
অধিকার শব্দে অধি উপসর্গটি কি অর্থে নির্দেশ করে? ,সদৃশ ,বিশেষ ,পর্যন্ত ,আধিপত্য ,4,",",',",",',',",",',"',",',',",",',আধিপত্য ,',",",',4,');,#REF!
আজপুকুর শব্দে অজ উপসর্গটি কোন অর্থে ব্যবহৃত হয়েছে? ,সম্পূর্ণ ,খাঁটি ,নিন্দিত ,অস্পষ্ট ,3,",",',",",',',",",',"',",',',",",',অস্পষ্ট ,',",",',3,');,#REF!
নিষিদ্ধ লোবান গ্রন্থের রচয়িতা কে? ,শামসুর রাহমান ,সৈয়দ শামসুল হক ,আলাউদ্দিন আল আজাদ ,হুমায়ুন আজাদ ,2,",",',",",',',",",',"',",',',",",',হুমায়ুন আজাদ ,',",",',2,');,#REF!
তন্বী শব্দের কোনটি সঠিক সন্ধি বিচ্ছেদ? ,তন + ঈ ,তন + ই ,তনু + ই ,তনু + ঈ ,4,",",',",",',',",",',"',",',',",",',তনু + ঈ ,',",",',4,');,#REF!
ফরাসি ভাষার উপসর্গ কোনটি? ,কম্‌ ,উৎ ,উন ,কু ,1,",",',",",',',",",',"',",',',",",',কু ,',",",',1,');,#REF!
সংস্কৃতি ভাঙ্গা সেতু গ্রন্থের রচয়িতা কে? ,কাজী মোতাহার হোসেন ,আখতারুজ্জামান ইলিয়াস ,বিনয় ঘোষ ,রাধারমন মিত্র ,2,",",',",",',',",",',"',",',',",",',রাধারমন মিত্র ,',",",',2,');,#REF!
কোন সাহিত্যাদর্শের মর্মে নৈরাশ্যবাদ আছে? ,রোমান্টিসিজম ,অয়াধুনিকতাবাদ ,উত্তরাধুনিকতাবাদ ,বাস্তববাদ ,3,",",',",",',',",",',"',",',',",",',বাস্তববাদ ,',",",',3,');,#REF!
বিধু শব্দটির অর্থ কী? ,আকাশ ,বাতাস ,তারা ,চাঁদ ,4,",",',",",',',",",',"',",',',",",',চাঁদ ,',",",',4,');,#REF!
যা ভাষায় প্রকাশ করা যায় না এক কথায় কী বলে? ,অনির্বাচনীয় ,অনির্বাচ্য ,অনির্দেশ্য ,অনির্ণেয় ,1,",",',",",',',",",',"',",',',",",',অনির্ণেয় ,',",",',1,');,#REF!
কোনটি উপসর্গযোগে গঠিত শব্দ নয়? ,হরহামেশা ,হরতাল ,হররোজ ,হরদম ,2,",",',",",',',",",',"',",',',",",',হরদম ,',",",',2,');,#REF!
কোনটি শুদ্ধ বানান? ,সমচীন ,সমীচিন ,সমীচীন ,সমিচিন ,3,",",',",",',',",",',"',",',',",",',সমিচিন ,',",",',3,');,#REF!
কোন শব্দটি ইক প্রত্যয় যুক্ত নয়? ,ধনিক ,মাসিক ,ভাষিক ,বণিক ,4,",",',",",',',",",',"',",',',",",',বণিক ,',",",',4,');,#REF!
পিশাচ- পিচাশ এরূপ পরিবর্তনকে বলা হয়- ,ধ্বনি বিপর্যয় ,স্বরভক্তি ,স্বরসঙ্গতি ,ধ্বনিবিকার ,1,",",',",",',',",",',"',",',',",",',ধ্বনিবিকার ,',",",',1,');,#REF!
নিত্য মূর্ধণ্য-ণ বাচক শব্দ কোনটি? ,তৃণ ,লবণ ,গ্রহণ ,লক্ষণ ,2,",",',",",',',",",',"',",',',",",',লক্ষণ ,',",",',2,');,#REF!
তারিখ শব্দটি বাংলায় এসেছে কোন ভাষা থেকে? ,আরবি ,সংস্কৃত ,ফারসি ,হিন্দি ,3,",",',",",',',",",',"',",',',",",',হিন্দি ,',",",',3,');,#REF!
আশেয় বসতি কোন কবির রচনা? ,ফররুখ আহমেদ ,সৈয়দ আলী আহসান ,আবুল হোসেন ,আহসান হাবীব ,4,",",',",",',',",",',"',",',',",",',আহসান হাবীব ,',",",',4,');,#REF!
কাজী নজরুল ইসলামের বিদ্রোহী কবিতায় মূল সুর হচ্ছে? ,বিদ্রোহ ও বিপবের আবেগ ,স্বরাজ প্রতিষ্ঠা ,প্রকৃতি বন্দনা ,প্রেম ,1,",",',",",',',",",',"',",',',",",',প্রেম ,',",",',1,');,#REF!
বনলতা সেন কোন কবির কাব্যগ্রন্থের নাম? ,বুদ্ধদেব বসু ,জীবনানন্দ দাশ ,অমিয় চক্রবর্তী ,বিষ্ণু দে ,2,",",',",",',',",",',"',",',',",",',বিষ্ণু দে ,',",",',2,');,#REF!
কাশীরাম দাসের অনুদিত গ্রন্থ কোনটি? ,রামায়ণ ,মেঘদুত ,মহাভারত ,শকুন্তলা ,3,",",',",",',',",",',"',",',',",",',শকুন্তলা ,',",",',3,');,#REF!
বাংলা সনের প্রবর্তক কে? ,সম্রাট আকবর ,নবাব আলিবর্দী খাঁ ,লক্ষণ সেন ,আবুল ফজল ,1,",",',",",',',",",',"',",',',",",',আবুল ফজল ,',",",',1,');,#REF!
গঠনগত দিক থেকে শব্দ কয়ভাগে বিভক্ত? ,এক ,দুই ,তিন ,চার ,2,",",',",",',',",",',"',",',',",",',চার ,',",",',2,');,#REF!
দেখিয়া শব্দের চলিত রূপ কোনটি? ,দেখিল ,দেখিয়াছি ,দেখাইয়া ,দেখে ,4,",",',",",',',",",',"',",',',",",',দেখে ,',",",',4,');,#REF!
পরাভব শব্দে পরা উপসর্গটি কোন অর্থে ব্যবহৃত হয়েছে? ,অভাব ,আধিক্য ,বিপরীত ,বিকৃত ,3,",",',",",',',",",',"',",',',",",',বিকৃত ,',",",',3,');,#REF!
এক কথায় প্রকাশ করুনঃ যে নারীর হাসি সুন্দর ,সুস্মিতা ,সুহাসিনী ,সুচিস্মিতা ,সুহাসি ,1,",",',",",',',",",',"',",',',",",',সুহাসি ,',",",',1,');,#REF!
কাজী নজরুল ইসলাম কোন পত্রিকায় সম্পাদক ছিলেন? ,মোসলেম ভারত ,সওগাত ,সবুজপত্র ,ধূমকেতু ,4,",",',",",',',",",',"',",',',",",',ধূমকেতু ,',",",',4,');,#REF!
সন্ধি ব্যাকরণের কোন অংশ আলোচিত হয়? ,ভাষাতত্ত্ব ,ধ্বনিতত্ত্ব ,রূপতত্ত্ব ,বাক্যতত্ত্ব ,2,",",',",",',',",",',"',",',',",",',বাক্যতত্ত্ব ,',",",',2,');,#REF!
নির্দিষ্ট পরিবেশে মানুষের কথা বা ভাবের প্রতীক কোনটি? ,ভাষা ,ধ্বনি ,শব্দ ,বাক্য ,3,",",',",",',',",",',"',",',',",",',বাক্য ,',",",',3,');,#REF!
মহৌষধি শব্দটির সঠিক সন্ধি বিচ্ছেদ কোনটি? ,মহা+ওষধি ,মহ+ওষধি ,মহা+ঔষধি ,মহ+ঔষধি ,1,",",',",",',',",",',"',",',',",",',মহ+ঔষধি ,',",",',1,');,#REF!
ভাষার কোন রীতি নাটকের সংলাপ ও বক্তবতার অনুপযোগী? ,চলিত রীতি ,আঞ্চলিক রীতি ,কথ্য রীতি ,সাধু রীতি ,4,",",',",",',',",",',"',",',',",",',সাধু রীতি ,',",",',4,');,#REF!
এক কথায় প্রকাশ করুনঃ অনেক অভিজ্ঞতা আছে যার ,দূরদর্শী ,অভিজ্ঞ ,বহুদর্শী ,ত্রিকালজ্ঞ ,3,",",',",",',',",",',"',",',',",",',ত্রিকালজ্ঞ ,',",",',3,');,#REF!
চোখ পাকানো বাগধারাটির সঠিক অর্থ কি? ,ইঙ্গিত করা ,ক্রোধ দেখানো ,সতর্ক করা ,ফাঁকি দেয়া ,2,",",',",",',',",",',"',",',',",",',ফাঁকি দেয়া ,',",",',2,');,#REF!
সুলতানার স্বপ্ন গ্রন্থটি কোন সাহিত্যিকের রচনা? ,রোকেয়া সাখাওয়াত হোসেন ,কবি সুফিয়া কামাল ,রাবেয়া খাতুন ,সেলিনা হোসেন ,1,",",',",",',',",",',"',",',',",",',সেলিনা হোসেন ,',",",',1,');,#REF!
Code শব্দের সঠিক পরিভাষা কোনটি? ,নীতি ,নিয়ম ,সংকেত ,বিধি ,3,",",',",",',',",",',"',",',',",",',বিধি ,',",",',3,');,#REF!
নিচের কোন যতি চিহ্নের ক্ষেত্রে কোনো বিরামের প্রয়োজন হয় না? ,কমা ,প্রশ্নবোধক চিহ্ন ,কোলন ,ব্র্যাকেট ,4,",",',",",',',",",',"',",',',",",',ব্র্যাকেট ,',",",',4,');,#REF!
কোন কবি ছন্দের জাদুকর নামে পরিচিত? ,সুকুমার রায় ,সত্যেন্দ্রনাথ দত্ত ,আল মাহমুদ ,ভারতচন্দ্র ,2,",",',",",',',",",',"',",',',",",',ভারতচন্দ্র ,',",",',2,');,#REF!
তুরুপ শব্দটি কোন ভাষা থেকে আগত? ,ওলন্দাজ ,ফরাসি ,ফারসি ,পর্তুগিজ ,1,",",',",",',',",",',"',",',',",",',পর্তুগিজ ,',",",',1,');,#REF!
কাজী নজরুল ইসলাম তাঁর কোন কবিতার জন্য কারাভোগ করেন? ,বিদ্রোহী ,আনন্দময়ীর আগমনে ,সংকল্প ,সৃষ্টি সুখের উলাসে ,2,",",',",",',',",",',"',",',',",",',সৃষ্টি সুখের উলাসে ,',",",',2,');,#REF!
তৃষ্ণার্ত সন্ধি বিচ্ছেদ কোনটি? ,তৃষ্ণা + আর্ত ,তৃষ্ণা + ষ্ণর্ত ,তৃষ্ণা + ঋত ,তৃষ্ণা + রিত ,3,",",',",",',',",",',"',",',',",",',তৃষ্ণা + রিত ,',",",',3,');,#REF!
নিচের কোন গুলো কণ্ঠধ্বনি? ,ক খ গ ঘ ঙ ,চ ছ জ ছ ঞ ,ট ঠ ড ঢ ণ ,প ফ ব ভ ম ,1,",",',",",',',",",',"',",',',",",',প ফ ব ভ ম ,',",",',1,');,#REF!
বাংলা সাহিত্যের প্রাচীন নিদর্শন কোনটি? ,শ্রীকৃষ্ণকীর্তন ,মনসামঙ্গল ,চন্ডীমঙ্গল ,চর্যাপদ ,4,",",',",",',',",",',"',",',',",",',চর্যাপদ ,',",",',4,');,#REF!
পুতুল নাচের ইতিকথা উপন্যাসটি কার রচনা? ,বিভুতিভূষ বন্দ্যোপাধ্যায় ,মানিক বন্দ্যোপাধ্যায় ,জহির রায়হান ,বুদ্ধদেব বসু ,2,",",',",",',',",",',"',",',',",",',বুদ্ধদেব বসু ,',",",',2,');,#REF!
ণ-ত্ব ও ষ- ত্ব বিধান কোন শ্রেণির শব্দে অনুসৃত হয়? ,দেশি ,বিদেশি ,তৎসম ,খাঁটি বাংলা ,3,",",',",",',',",",',"',",',',",",',খাঁটি বাংলা ,',",",',3,');,#REF!
প্রদোষে প্রাকৃতজন উপন্যাসটির ঔপন্যাসিক কে? ,শহীদুলাহ কায়সার ,সৈয়দ ওয়ালীউলাহ ,রিজিয়া রহমান ,শওকত আলী ,4,",",',",",',',",",',"',",',',",",',শওকত আলী ,',",",',4,');,#REF!
পুত্র এর সমার্থক শব্দ কী? ,প্রসূন ,আত্মজ ,অদ্রি ,বামা ,2,",",',",",',',",",',"',",',',",",',বামা ,',",",',2,');,#REF!
দেবদত্ত কোন সমাস? ,চতুর্থ তৎপুরুষ ,প্রাদি তৎপুরুষ ,পঞ্চমী তৎপুরুষ ,তৃতীয় তৎপুরুষ ,1,",",',",",',',",",',"',",',',",",',তৃতীয় তৎপুরুষ ,',",",',1,');,#REF!
বন্দী শিবির থেকে কাব্যগ্রন্থের কবি কে? ,হাসান হাফিজুর রহমান ,রফিক আজাদ ,শামসুর রাহমান ,আল মাহমুদ ,3,",",',",",',',",",',"',",',',",",',আল মাহমুদ ,',",",',3,');,#REF!
ধনধান্য পুস্পভরা আমাদের এই বসুন্ধরা গানটির রচয়িতা কে? ,রবীন্দ্রনাথ ঠাকুর ,ডি.এল.রায় ,অতুল প্রসাদ ,আবুল লতিফ ,2,",",',",",',',",",',"',",',',",",',আবুল লতিফ ,',",",',2,');,#REF!
বঙ্গবাণী কবিতাটি কে রচনা করেছেন? ,মহাকবি আলাওল ,কায়কোবাদ ,মাইকেল মধুসূদন দত্ত ,আবদুল হাকিম ,4,",",',",",',',",",',"',",',',",",',আবদুল হাকিম ,',",",',4,');,#REF!
বাংলা ভাষায় পরাশ্রয়ী ধ্বনি কতটি? ,২ টি ,৩ টি ,৪ টি ,৫ টি ,2,",",',",",',',",",',"',",',',",",',৫ টি ,',",",',2,');,#REF!
জীবন বিনিময় কবিতাটি কে লিখেন? ,গোলাম মোস্তফা ,আহসান হাবীব ,ফররুখ আহমদ ,কায়কোবাদ ,1,",",',",",',',",",',"',",',',",",',কায়কোবাদ ,',",",',1,');,#REF!
নিচের কোন বহুবচনটি সঠিক? ,মনুষ্যসকল ,মনুষ্যসমূহ ,পাখিসব ,"ক,খ,গ ",4,",",',",",',',",",',"',",',',",",',"ক,খ,গ ",',",",',4,');,#REF!
কিরণ শব্দের সমার্থক শব্দ কোনটি? ,ঢেউ ,ভাগ্য ,প্রভা ,হর্ষ ,3,",",',",",',',",",',"',",',',",",',হর্ষ ,',",",',3,');,#REF!
নিরুৎসাহ শব্দের ব্যাসবাক্য কোনটি? ,নাই উৎসাহ ,উৎসাহের অভাব ,উৎসাহ নাই যার ,নঞ উৎসাহ ,2,",",',",",',',",",',"',",',',",",',নঞ উৎসাহ ,',",",',2,');,#REF!
আড়চোখে শব্দের আড় উপসর্গটি কি অর্থ প্রকাশ করেছে? ,বক্র ,খারাপ ,হিংসা ,উৎসাহ ,1,",",',",",',',",",',"',",',',",",',উৎসাহ ,',",",',1,');,#REF!
নিচের কোন শব্দটি শুদ্ধ? ,উর্ধ ,অত্যান্ত ,উচিৎ ,কোনটিই নয় ,4,",",',",",',',",",',"',",',',",",',কোনটিই নয় ,',",",',4,');,#REF!
বিবিশিরি কোথায় অবস্থিত? ,কিশোরগঞ্জ জেলায় ,নেত্রকোণা জেলায় ,শেরপুর জেলায় ,সিলেট জেলায় ,2,",",',",",',',",",',"',",',',",",',সিলেট জেলায় ,',",",',2,');,#REF!
সপ্তাদশ শতকের কবি আলাওলের প্রধান কাব্য কোনটি? ,পদ্মাবতী ,সয়ফলমুলক-বদিউজ্জামাল ,হপ্ত পয়কর ,তোহ্‌ফা ,1,",",',",",',',",",',"',",',',",",',তোহ্‌ফা ,',",",',1,');,#REF!
কোন বানানটি শুদ্ধ? ,সজ্ঞা ,সংজ্ঞা ,সংগা ,সংঙ্গা ,2,",",',",",',',",",',"',",',',",",',সংঙ্গা ,',",",',2,');,#REF!
বাংলাদেশে প্রমিত বাংলা বানানের নিয়ম চালু করে কোন প্রতিষ্ঠান? ,এশিয়াটিক সোসাইটি ,শিল্পকলা একাডেমি ,ঢাকা বিশ্ব বিদ্যালয় ,বাংলা একাডেমী ,4,",",',",",',',",",',"',",',',",",',বাংলা একাডেমী ,',",",',4,');,#REF!
ঐতিহাসিক পানাম নগর কোথায় অবস্থিত? ,ময়নামতিতে ,মহাস্থানগড়ে ,সোনারগাঁয়ে ,বৌদ্ধ বিহারে ,3,",",',",",',',",",',"',",',',",",',বৌদ্ধ বিহারে ,',",",',3,');,#REF!
