question,answerA,answerB,answerC,answerD,correctAnswer,,,,,,,,,,,,,,,,,,,
রাবণের চিতা বাগধারটির অর্থ ,চির অশান্তি ,অরাজক দেশ ,অনিষ্টে ইষ্ট লাভ ,সামান্য ঝগড়া ,1,",",',",",',',",",',"',",',',",",',সামান্য ঝগড়া ,',",",',1,');,#REF!
চাচা-কাহিনীর লেখক কে? ,সৈয়দ শামসুল হক ,মুনীর চৌধুরী ,সৈয়দ মুজতবা আলী ,হুমায়ুন আজাদ ,3,",",',",",',',",",',"',",',',",",',হুমায়ুন আজাদ ,',",",',3,');,#REF!
কোনটি বিশেষণ বাক্যের শব্দ? ,জীবন ,জীবনী ,জীবাণু ,জীবিকা ,2,",",',",",',',",",',"',",',',",",',জীবিকা ,',",",',2,');,#REF!
নির্মল এর বিপরীত শব্দ কি? ,আশা ,বিশুদ্ধ ,পঙ্কিল ,ভাল ,3,",",',",",',',",",',"',",',',",",',ভাল ,',",",',3,');,#REF!
ক্রিয়াপদের মুল অংশকে বলা হয় ,প্রত্যয় ,বিভক্তি ,সমাস ,ধাতু ,4,",",',",",',',",",',"',",',',",",',ধাতু ,',",",',4,');,#REF!
সে কি যাবে এটি কোন ধরনের বাক্য? ,প্রশ্নসূচক ,আদেশমূলক ,বিবৃতিমূলক ,বিস্ময়সূচক ,1,",",',",",',',",",',"',",',',",",',বিস্ময়সূচক ,',",",',1,');,#REF!
এসপার ওসপার বাগধারাটির অর্থ কি? ,এদিক অথবা ওদিক ,মীমাংসা ,এই পাড়ে বা ঐ পাড়ে ,এ রকম অথবা ঐ রকম ,2,",",',",",',',",",',"',",',',",",',এ রকম অথবা ঐ রকম ,',",",',2,');,#REF!
গোবর গণেশ এই বাগধারাটির অর্থ কী? ,গোবরের মত আবর্জনা ,চালাক ,ধোকা ,মূর্খ ,4,",",',",",',',",",',"',",',',",",',মূর্খ ,',",",',4,');,#REF!
গুড়ে বালি কথাটির অর্থ কি? ,গোবরে পদ্ম ফুল ,ভালতে খারাপ ,আশায় নৈরাশ্য ,বাতাসে বালি ,3,",",',",",',',",",',"',",',',",",',বাতাসে বালি ,',",",',3,');,#REF!
কন্যা শব্দের সমার্থক শব্দ কোনটি? ,তনয়া ,অনুজা ,অবলা ,সুত ,1,",",',",",',',",",',"',",',',",",',সুত ,',",",',1,');,#REF!
বগুড়ায় চিনিপাতা দই সুস্বাদু । বাক্যটির চিনিপাতা কোন কারক? ,অধিকরণ ,অপাদান ,করণ ,কর্ম ,2,",",',",",',',",",',"',",',',",",',কর্ম ,',",",',2,');,#REF!
বাড়ি গিয়ে তাকে পাওয়া যায়নি এ বাক্যে গিয়ে কোন ক্রিয়া? ,সমাপিকা ,দ্বিকর্মক ,প্রযোজক ,অসমাপিকা ,4,",",',",",',',",",',"',",',',",",',অসমাপিকা ,',",",',4,');,#REF!
গবাদি পশুর পাল এর সংক্ষেপ হলো- ,বাথান ,গোশালা ,কাস্তা ,পশুপাল ,1,",",',",",',',",",',"',",',',",",',পশুপাল ,',",",',1,');,#REF!
কোনটি মেঘ শব্দের প্রতিশব্দ হলো- ,ব্যরিদ ,অন্তরীক্ষ ,জলদ ,জীমূত ,2,",",',",",',',",",',"',",',',",",',জীমূত ,',",",',2,');,#REF!
কোন শব্দটি খাঁটি বাংলা উপসর্গ থেকে ব্যবহৃত হয়েছে? ,আভাস ,গরমিল ,অজানা ,বেমালুম ,3,",",',",",',',",",',"',",',',",",',বেমালুম ,',",",',3,');,#REF!
মৃম্ময় শব্দের সঠিক সন্ধি বিচ্ছেদ কোনটি? ,মৃত + ময় ,মৃন + মায় ,ম্রত + ময় ,মৃৎ + ময় ,4,",",',",",',',",",',"',",',',",",',মৃৎ + ময় ,',",",',4,');,#REF!
আবার আসিব ফিবে কবিতাটি জীবনানন্দ দাশ এর কোন কাব্যগ্রন্থ থেকে নেওয়া হয়েছে? ,রূপসী বাংলা ,বনলতা সেন ,বনলতা সেন ,ধূসর পাণ্ডুলিপি ,1,",",',",",',',",",',"',",',',",",',ধূসর পাণ্ডুলিপি ,',",",',1,');,#REF!
ছিয়াত্তরের মম্বন্তর নামক ভয়াবহ দুর্ভিক্ষ কত সালে ঘটে? ,বাংলা ১২৭৬ সালে ,বাংলা ১০৭৬ সালে ,বাংলা ১১৭৬ সালে ,বাংলা ১৯৬৭ সালে ,3,",",',",",',',",",',"',",',',",",',বাংলা ১৯৬৭ সালে ,',",",',3,');,#REF!
কোনটি অর্থ তৎসম শব্দ? ,গেঞ্জী ,গিন্নী ,লুঙ্গি ,হস্তী ,2,",",',",",',',",",',"',",',',",",',হস্তী ,',",",',2,');,#REF!
ইতর বিশেষ বাগধারাটির অর্থ কি? ,অতিশয় অভদ্র ,অপাদার্থ ,পার্থক্য ,অভদ্র ,3,",",',",",',',",",',"',",',',",",',অভদ্র ,',",",',3,');,#REF!
সংশয় এর বিপরীতর্থক শব্দ কোনটি? ,দ্বিধা ,ভয় ,বিস্ময় ,প্রত্যয় ,4,",",',",",',',",",',"',",',',",",',প্রত্যয় ,',",",',4,');,#REF!
সারাংশ নিচের কোনটি প্রয়োজন নেই? ,অলঙ্কার ,প্রাঞ্জলতা ,সরলতা ,সংক্ষেপণ ,1,",",',",",',',",",',"',",',',",",',সংক্ষেপণ ,',",",',1,');,#REF!
কর্মে যার ক্লান্তি নেই এর বাক্যাংশের সংক্ষিপ্ত রূপ কী? ,অক্লান্ত ,ক্লান্তিহীন ,অক্লান্তকর্মী ,অবিশ্রম ,3,",",',",",',',",",',"',",',',",",',অবিশ্রম ,',",",',3,');,#REF!
কোনটি উভয়লিঙ্গ বাচক শব্দ? ,টেবিল ,মানুষ ,সৈন্য ,প্রিয় ,2,",",',",",',',",",',"',",',',",",',প্রিয় ,',",",',2,');,#REF!
ঝিনুক থেকে মুক্তা মেলে এখানে ঝিনুক কোন কারক? ,অপাদান কারক ,সম্প্রদান করক ,অধিকরণ করক ,কর্ম কারক ,1,",",',",",',',",",',"',",',',",",',কর্ম কারক ,',",",',1,');,#REF!
দন্ত্য বর্ণ কোনগুলি? ,"ক, খ, গ, ঘ ","প, ফ, ব, ভ ","ট, ঠ, ড, ঢ ","ত, থ, দ, ধ ",4,",",',",",',',",",',"',",',',",",',"ত, থ, দ, ধ ",',",",',4,');,#REF!
ধ্বনি উচ্চারণে মানব শরীরের যেসব প্রত্যঙ্গ জড়িত সেগুলোকে একত্রে কী বলে? ,শ্বাসনালী ,গলনালি ,বাগযন্ত্র ,স্বরযন্ত্র ,3,",",',",",',',",",',"',",',',",",',স্বরযন্ত্র ,',",",',3,');,#REF!
কোন বানানটি শুদ্ধ? ,মরীচিকা ,মরিচিকা ,মরিচীকা ,মরীচিকা ,4,",",',",",',',",",',"',",',',",",',মরীচিকা ,',",",',4,');,#REF!
প্রচলিত শব্দটি কোন প্রত্যয় যোগে গঠিত? ,ঈয় প্রত্যয় ,ইত প্রত্যয় ,ই প্রত্যয় ,ত প্রত্যয় ,2,",",',",",',',",",',"',",',',",",',ত প্রত্যয় ,',",",',2,');,#REF!
কার্তিক ও অগ্রহায়ণ দুই মাস কি কাল? ,হেমন্তকাল ,বসন্তকাল ,শরৎকাল ,শীতকাল ,1,",",',",",',',",",',"',",',',",",',শীতকাল ,',",",',1,');,#REF!
বক্তার প্রত্যক্ষ উক্তিকে অন্তর্ভুক্ত করার জন্য কোন বিরাম চিহ্ন বসে? ,কোলন ,উদ্বরণ চিহ্ন ,হাইফেন ,সেমিকোলন ,2,",",',",",',',",",',"',",',',",",',সেমিকোলন ,',",",',2,');,#REF!
কোনটি শুদ্ধ বাক্য? ,চন্দ্র সূর্যগ্রহণ অপেক্ষা বিস্ময়কর ঘটনা ,চন্দ্র ও সূর্যগ্রহণ দুটি বিস্ময়কর ঘটনা ,চন্দ্রগ্রহণ ও সূর্যগ্রহণ দুটি বিস্ময়কর ঘটনা ,চন্দ্র অপেক্ষা সূর্যগ্রহণ বিস্ময়কর ঘটনা ,3,",",',",",',',",",',"',",',',",",',চন্দ্র অপেক্ষা সূর্যগ্রহণ বিস্ময়কর ঘটনা ,',",",',3,');,#REF!
কোনটি সঠিক বানান? ,সতস্ফুর্ত ,স্বতঃস্ফূর্ত ,স্বতঃস্ফুর্ত ,স্বতস্ফূর্ত ,2,",",',",",',',",",',"',",',',",",',স্বতস্ফূর্ত ,',",",',2,');,#REF!
তার হাতের লেখা খুব ভাল এখানে খুব কী পদ? ,বিশেষণ ,ক্রিয়া ,বিশেষ্য ,অব্যয় ,1,",",',",",',',",",',"',",',',",",',অব্যয় ,',",",',1,');,#REF!
মনীষা শব্দের সঠিক সন্ধি বিচ্ছেদ কোনটি? ,মনী + ইষা ,মনি + ঈষা ,মনস্‌ + ঈষা ,মনঃ + ঈষা ,3,",",',",",',',",",',"',",',',",",',মনঃ + ঈষা ,',",",',3,');,#REF!
ধীমান শব্দটির অর্থ কী? ,নিরীহ ,শান্ত ,প্রজ্ঞাবান ,বুদ্ধিমান ,4,",",',",",',',",",',"',",',',",",',বুদ্ধিমান ,',",",',4,');,#REF!
সম্বোধনের পর কোন চিহ্ন বসে ,দাঁড়ি ,কমা ,কোন চিহ্নই নয় ,সেমিকোলন ,2,",",',",",',',",",',"',",',',",",',সেমিকোলন ,',",",',2,');,#REF!
হাড় হাভাতে বাগধারাটির অর্থ কোনটি? ,রোগা ,দরিদ্র ,হতভাগ্য ,ক্ষুধার্ত ,3,",",',",",',',",",',"',",',',",",',ক্ষুধার্ত ,',",",',3,');,#REF!
বৃক্ষ শব্দের সমার্থক শব্দ নয় কোনটি? ,বনানী ,শিখরী ,পাদপ ,বিটপী ,1,",",',",",',',",",',"',",',',",",',বিটপী ,',",",',1,');,#REF!
কপোত শব্দটির সঠিক অর্থ কোনটি? ,কোকিল ,বক ,ময়ূর ,কবুতর ,4,",",',",",',',",",',"',",',',",",',কবুতর ,',",",',4,');,#REF!
যার অগমনের কোন তিথি নেই তাকে বলা হয় ,তীর্থযাত্রী ,আগন্তুক ,অতিথি ,তিথিহীন ,3,",",',",",',',",",',"',",',',",",',তিথিহীন ,',",",',3,');,#REF!
কোনটি সঠিক বানান? ,নিশীথিনী ,নিশিথিনি ,নিশিথিনী ,নীশিথিনী ,1,",",',",",',',",",',"',",',',",",',নীশিথিনী ,',",",',1,');,#REF!
দিবারাত্রির কাব্য কার লেখা? ,বন্দে আলী মিয়া ,মানিক বন্দ্যোপাধ্যায় ,গোলাম মোস্তফা ,সুফিয়া কামাল ,2,",",',",",',',",",',"',",',',",",',সুফিয়া কামাল ,',",",',2,');,#REF!
লস্ফ প্রদান করিল এর চলিত রূপ কোনটি? ,লাফ প্রদান করল ,লস্ফ প্রদান করল ,লস্ফ দিল ,লাফ কিল ,4,",",',",",',',",",',"',",',',",",',লাফ কিল ,',",",',4,');,#REF!
কোন বানানটি সঠিক? ,ষান্মসিক ,সান্মসিক ,ষাণ্মাসিক ,ষান্মষিক ,3,",",',",",',',",",',"',",',',",",',ষান্মষিক ,',",",',3,');,#REF!
নিচের কনটি চলিত রীতির শব্দ? ,তুলা ,শুকনো ,পড়িল ,সহিত ,2,",",',",",',',",",',"',",',',",",',সহিত ,',",",',2,');,#REF!
"লোকটি যদিও ধনী, তবুও সে কৃপণ কোন ধরনের বাক্য? ",জটিল ,যৌগিক ,সরল ,খন্ড ,1,",",',",",',',",",',"',",',',",",',খন্ড ,',",",',1,');,#REF!
গীতাঞ্জলী কার লেখা? ,শামসুর রাহমান ,কাজী নজরুল ইসলাম ,রবীন্দ্রনাথ ঠাকুর ,মধুসূদন দত্ত ,3,",",',",",',',",",',"',",',',",",',মধুসূদন দত্ত ,',",",',3,');,#REF!
নিচের কোনটি চলিত ভাষা রীতির উদাহরণ? ,প্রভাব হইয়াছে ,গতকাল খেলা দেখিয়াছিলাম ,সুজন তাহাকে দেখেছে ,আমি তাকে দেখে খুশি হয়েছি ,4,",",',",",',',",",',"',",',',",",',আমি তাকে দেখে খুশি হয়েছি ,',",",',4,');,#REF!
মনের ভাব প্রকাশের প্রধান বাহন কোনটি? ,চিত্র ,ভাষা ,লেখা ,ইঙ্গিত ,2,",",',",",',',",",',"',",',',",",',ইঙ্গিত ,',",",',2,');,#REF!
অকাল কূষ্মাণ্ড শব্দের অর্থ কি? ,মিথ্যাবাদী ,বড়াই ,অপদার্থ ,অপরিপক্ক ,3,",",',",",',',",",',"',",',',",",',অপরিপক্ক ,',",",',3,');,#REF!
অপমান শব্দের অপ উপসর্গটি কোন অর্থে ব্যবহৃত? ,বিপরীত ,বিকৃত ,অভাব ,নিকৃষ্ট ,1,",",',",",',',",",',"',",',',",",',নিকৃষ্ট ,',",",',1,');,#REF!
"যা পূর্বে ছিল, এখন নেই, এক কথায় কি বলে? ",অপূর্ব ,অদৃষ্টপূর্ব ,অভূতপূর্ব ,ভূতপূর্ব ,4,",",',",",',',",",',"',",',',",",',ভূতপূর্ব ,',",",',4,');,#REF!
পানির সমার্থক শব্দ কোনটি? ,কেকা ,বারি ,সম্বর ,সারঙ্গ ,2,",",',",",',',",",',"',",',',",",',সারঙ্গ ,',",",',2,');,#REF!
প্রচুর শব্দের বিশেষ্য রূপ কোনটি? ,প্রাচুর্য ,প্রচার ,প্রাচ্য ,প্রচারণা ,1,",",',",",',',",",',"',",',',",",',প্রচারণা ,',",",',1,');,#REF!
পাখির ডাক ,কূজন ,হেষা ,কেকা ,অজিন ,1,",",',",",',',",",',"',",',',",",',অজিন ,',",",',1,');,#REF!
"তাঁর টাকা আছে কিন্তু তিনি দান করেন না, কোন ধরনের বাক্য ",খণ্ড ,যৌগিক ,জটিল ,সরল ,2,",",',",",',',",",',"',",',',",",',সরল ,',",",',2,');,#REF!
জিভের সামনের অংশের সাহায্যে উচ্চারিত স্বরধ্বনিগুলোকে কী বলে? ,সম্মুখ-স্বরধ্বনি ,অগ্র-স্বরধ্বনি ,জিভ-স্বরধ্বনি ,নিম্ন-স্বরধ্বনি ,1,",",',",",',',",",',"',",',',",",',নিম্ন-স্বরধ্বনি ,',",",',1,');,#REF!
কোন বানানটি শুদ্ধ? ,Paralell ,Peralel ,Parelel ,Parallel ,4,",",',",",',',",",',"',",',',",",',Parallel ,',",",',4,');,#REF!
কাজলকালো এর সঠিক ব্যাসবাক্য কোনটি? ,কাজল রূপ কালো ,কাজলের ন্যায় কালো ,কাজল ও কালো ,কালো ও কাজল ,2,",",',",",',',",",',"',",',',",",',কালো ও কাজল ,',",",',2,');,#REF!
কোন শব্দটিতে বিদেশী প্রত্যয় ব্যবহৃত হয়েছে? ,কানকাটা ,বেয়াক্কেল ,দিগ্‌গজ ,চালবাজ ,4,",",',",",',',",",',"',",',',",",',চালবাজ ,',",",',4,');,#REF!
আকাশে চাঁদ উঠেছে এখানে আকাশ কোন কারকে কোন বিভক্তি? ,অধিকরণে সপ্তমী ,সম্প্রদানে চতুর্থী ,করণে ষষ্ঠী ,কর্মে শূন্য ,1,",",',",",',',",",',"',",',',",",',কর্মে শূন্য ,',",",',1,');,#REF!
মা খোকাকে চাঁদ দেখাচ্ছে এ বাক্যে দেখাচ্ছে কোন ক্রিয়া? ,সমাপিকা ,দ্বিকর্মক ,প্রযোজক ,অসমাপিকা ,3,",",',",",',',",",',"',",',',",",',অসমাপিকা ,',",",',3,');,#REF!
বিনা যত্নে উৎপন্ন হয় যা বাক্য সংকোচন কি? ,অযত্নজাত ,অযত্নলব্ধ ,অনায়াসলব্ধ ,অযত্নস্মভূত ,4,",",',",",',',",",',"',",',',",",',অযত্নস্মভূত ,',",",',4,');,#REF!
একইসঙ্গে উচ্চারিত দুইটি মিলিত স্বরধ্বনিকে কি বলে ,অনাসৃত স্বর ,যৌগিক স্বর ,একাক্ষর স্বর ,মৌলিক স্বর ,2,",",',",",',',",",',"',",',',",",',মৌলিক স্বর ,',",",',2,');,#REF!
বাংলাদেশের কোন নৃ-গোষ্ঠীর উৎসব সোহরাই ,চাকমা ,মারমা ,সাঁওতাল ,গারো ,3,",",',",",',',",",',"',",',',",",',গারো ,',",",',3,');,#REF!
আ মরি বাংলা ভাষা এখানে আ দ্বারা কি প্রকাশ করা হয়েছে? ,আনন্দ ,আনুগত্য ,আশা ,আবেগ ,1,",",',",",',',",",',"',",',',",",',আবেগ ,',",",',1,');,#REF!
কোন মুসলিম শাসন কালকে স্বর্ণযুগ বলা হয়? ,সম্রাট বাবর ,বখতিয়ার খলজি ,সম্রাট শাহজাহান ,হুসেন শাহ্‌ ,4,",",',",",',',",",',"',",',',",",',হুসেন শাহ্‌ ,',",",',4,');,#REF!
He came of with flying colours মানে ,তিনি উড়ন্ত রঙ নিয়ে এসেছিলেন। ,তিনি গৌরবময় সাফল্য অর্জন করেন। ,তিনি রং ছিটাতে ছিটেতে এসেছিলেন। ,বিজয়ের গৌরব নিয়ে তিনি উড়ে এসেছেন। ,2,",",',",",',',",",',"',",',',",",',বিজয়ের গৌরব নিয়ে তিনি উড়ে এসেছেন। ,',",",',2,');,#REF!
তোপান্তর কোন সমাসের উদাহরণ? ,বহুব্রীহি ,অব্যয়ীভাব ,দ্বিগু ,কর্মধারায় ,3,",",',",",',',",",',"',",',',",",',কর্মধারায় ,',",",',3,');,#REF!
গায়ক এর সন্ধি বিচ্ছেদ কোনটি? ,গৈ + অক ,গা + য়ক ,গে + য়ক ,গা + অক ,1,",",',",",',',",",',"',",',',",",',গা + অক ,',",",',1,');,#REF!
নিচের কোনটি Personal Pronoun? ,who ,you ,any ,this ,2,",",',",",',',",",',"',",',',",",',this ,',",",',2,');,#REF!
অসমাপ্ত অদ্ভুতসাগর গ্রন্থটি কে সমাপ্ত করেন? ,সম্রাট আকবর ,আলাউদ্দিন খিলজি ,বলাল সেন ,লক্ষণ সেন ,4,",",',",",',',",",',"',",',',",",',লক্ষণ সেন ,',",",',4,');,#REF!
চানাচুর শব্দটি কোন ভাষা থেকে বাংলা ভাষায় এসেছে? ,চীনা ,উর্দু ,হিন্দি ,আরবী ,3,",",',",",',',",",',"',",',',",",',আরবী ,',",",',3,');,#REF!
যিনি বক্তৃতা দানে পটু ,বাকপটু ,বাগ্মী ,উর্দু ,আরবী ,2,",",',",",',',",",',"',",',',",",',আরবী ,',",",',2,');,#REF!
কোনটি অনুজ্ঞা প্রকাশক? ,তুমি যাও ,তুমি যাচ্ছিলে ,তুমি যাচ্ছ ,তুমি গিয়াছিলে ,1,",",',",",',',",",',"',",',',",",',তুমি গিয়াছিলে ,',",",',1,');,#REF!
নিচের কোন বাগধারাটির ভিন্নার্থক ,লক্ষ্মীর বরযাত্রী ,দুধের মাছি ,সুখের পায়রা ,শরতের শিশির ,4,",",',",",',',",",',"',",',',",",',শরতের শিশির ,',",",',4,');,#REF!
নিচের কোনটি মিশ্র শব্দ? ,ফটোকপি ,হরতাল ,খ্রিস্টাব্দ ,আলকাতরা ,3,",",',",",',',",",',"',",',',",",',আলকাতরা ,',",",',3,');,#REF!
ধ্বনিজ্ঞাপক দ্বিরুক্ত শব্দ কোনটি? ,কড়কড় ,দরদর ,মরমর ,নড়নড় ,1,",",',",",',',",",',"',",',',",",',নড়নড় ,',",",',1,');,#REF!
রি রি কথা দিয়া কি প্রকাশ পায়? ,তীব্র ব্যথা ,তীব্র ক্রোধ ,বড়া কথা ,কড়া মেজাজ ,2,",",',",",',',",",',"',",',',",",',কড়া মেজাজ ,',",",',2,');,#REF!
শুদ্ধ বানান কোনটি? ,গ্রীহস্থ ,গৃহস্ত ,গ্রীহস্ত ,গৃহস্থ ,4,",",',",",',',",",',"',",',',",",',গৃহস্থ ,',",",',4,');,#REF!
কোনটি শুদ্ধ বানান? ,দুষণ ,দূশন ,দূষণ ,দুশন ,3,",",',",",',',",",',"',",',',",",',দুশন ,',",",',3,');,#REF!
জিলাপীর প্যাঁচ বাগধারাটির অর্থ কি? ,কলহপ্রিয় ,জটিল ,প্যাচানো ,কুটিল ,4,",",',",",',',",",',"',",',',",",',কুটিল ,',",",',4,');,#REF!
অপমান শব্দের অপ উপসর্গটি কোন অর্থে ব্যবহৃত? ,বিপরীত ,নিখুঁত ,নিকৃষ্ট ,অভাব ,1,",",',",",',',",",',"',",',',",",',অভাব ,',",",',1,');,#REF!
দুবার জন্মে যা ,পুনর্জন্ম ,দ্বৈত জন্ম ,দ্বিজ ,দ্বিজন্ম ,3,",",',",",',',",",',"',",',',",",',দ্বিজন্ম ,',",",',3,');,#REF!
আট কপালে অর্থ কি? ,সৌভাগ্যবান ,হতভাগ্য ,জ্ঞানী ,হতাশ ,2,",",',",",',',",",',"',",',',",",',হতাশ ,',",",',2,');,#REF!
চাঁদের হাট কথাটির অর্থ কি? ,পূর্ণিমা রাত ,কচিকাঁচার মেলা ,আনন্দের প্রাচুর্য ,জ্যোৎস্না ,3,",",',",",',',",",',"',",',',",",',জ্যোৎস্না ,',",",',3,');,#REF!
জোঁক গল্পের রচিয়তা ,শাহেদ আলী ,শওকত আলী ,আল মাহমুদ ,আবু ইসহাক ,4,",",',",",',',",",',"',",',',",",',আবু ইসহাক ,',",",',4,');,#REF!
লোকটি দরিদ্র কিন্তু সৎ এ বাক্যে কিন্তু হলো ,অনুকার অব্যয় ,সংকোচন অব্যয় ,সংযোজক অব্যয় ,অনম্বয়ী অব্যয় ,2,",",',",",',',",",',"',",',',",",',অনম্বয়ী অব্যয় ,',",",',2,');,#REF!
মেঘলা কি ধরনের শব্দ? ,বিশেষ্যের বিশেষণ ,ক্রিয়া বিশেষণ ,বিশেষ্য ,বিশেষণ ,4,",",',",",',',",",',"',",',',",",',বিশেষণ ,',",",',4,');,#REF!
আমি চা পান করি না এর ইংরেজি ,I do not drink tea ,I do not take tea ,I do not have tea ,I do not like tea ,2,",",',",",',',",",',"',",',',",",',I do not like tea ,',",",',2,');,#REF!
সুন্দর মাত্ররেই একটা আকর্ষণ শক্তি আছে। বাক্যে সুন্দর শব্দটি কোন পদ? ,বিশেষ্য ,বিশেষণ ,সর্বনাম ,অব্যয় ,1,",",',",",',',",",',"',",',',",",',অব্যয় ,',",",',1,');,#REF!
